{
  "updateManifestVersion": 1,
  "id": "plugin-template",
  "version": "1.0.0",
  "downloadUrl": "https://github.com/fuyu2022/desktop-art-plugin/releases/download/plugin-template-v1.0.0/plugin-template-1.0.0.zip",
  "releaseUrl": "https://github.com/fuyu2022/desktop-art-plugin/releases/tag/plugin-template-v1.0.0",
  "sha256": "0f8f996d20b966be0209a5dbe43a473f9253802eba47db3b1da85416fee6b8d0",
  "notes": "首次发布。"
}
